{
  "version": "0.3.0",
  "generated": "2025-08-11T00:00:00Z",
  "paramon_rules": {
    "NATIVITY_PARAMON": {
      "feast_code": "NATIVITY",
      "feast_day": 29,
      "feast_month": 4,
      "mapping": {
        "MON": [-2, -1],
        "TUE": [-2, -1],
        "WED": [-1],
        "THU": [-1],
        "FRI": [-1],
        "SAT": [-2, -1],
        "SUN": [-2]
      }
    },
    "THEOPHANY_PARAMON": {
      "feast_code": "THEOPHANY",
      "feast_day": 11,
      "feast_month": 5,
      "mapping": {
        "MON": [-2, -1],
        "TUE": [-2, -1],
        "WED": [-1],
        "THU": [-1],
        "FRI": [-1],
        "SAT": [-2, -1],
        "SUN": [-2]
      }
    }
  },
  "feasts_fixed": [
    { "code":"NAYROUZ","jour_copte":1,"mois_copte":1,"rang":"autre","titre_ar":"عيد النيروز","titre_fr":"Nayrouz","resume_ar":"بداية السنة القبطية وتذكار الشهداء.","mots_cles_ar":["شهداء","سنة"],"actif":true },
    { "code":"ANNUNCIATION","jour_copte":29,"mois_copte":7,"rang":"seigneuriale_majeure","titre_ar":"عيد البشارة","titre_fr":"Annonciation","resume_ar":"تذكار بشارة الملاك للعذراء بالتجسد.","mots_cles_ar":["بشارة","تجسد"] },
    { "code":"NATIVITY","jour_copte":29,"mois_copte":4,"rang":"seigneuriale_majeure","titre_ar":"عيد الميلاد","titre_fr":"Nativité","resume_ar":"ميلاد السيد المسيح بالجسد.","mots_cles_ar":["ميلاد"] },
    { "code":"THEOPHANY","jour_copte":11,"mois_copte":5,"rang":"seigneuriale_majeure","titre_ar":"عيد الغطاس","titre_fr":"Théophanie","resume_ar":"إعلان الثالوث في معمودية المسيح.","mots_cles_ar":["معمودية"] },
    { "code":"ENTRY_EGYPT","jour_copte":24,"mois_copte":9,"rang":"seigneuriale_mineure","titre_ar":"دخول المسيح أرض مصر","titre_fr":"Entrée en Égypte","resume_ar":"رحلة العائلة المقدسة داخل مصر.","mots_cles_ar":["مصر"] },
    { "code":"TRANSFIGURATION","jour_copte":13,"mois_copte":12,"rang":"seigneuriale_mineure","titre_ar":"عيد التجلي","titre_fr":"Transfiguration","resume_ar":"مجد المسيح على جبل تابور.","mots_cles_ar":["تجلي"] },
    { "code":"ARCHANGEL_MICHAEL_MONTHLY","jour_copte":12,"mois_copte":0,"rang":"archange","titre_ar":"تذكار الملاك ميخائيل","titre_fr":"Mémoire Archange Michel","resume_ar":"تذكار شهري للملاك ميخائيل.","mots_cles_ar":["ميخائيل"] },
    { "code":"VIRGIN_MARY_MONTHLY","jour_copte":21,"mois_copte":0,"rang":"mariale","titre_ar":"تذكار السيدة العذراء","titre_fr":"Mémoire Vierge Marie","resume_ar":"تذكار شهري للسيدة العذراء.","mots_cles_ar":["العذراء"]}
  ],
  "feasts_movable": [
    { "code":"PASCHA","offset_jours":0,"rang":"seigneuriale_majeure","titre_ar":"عيد القيامة","titre_fr":"Pâques","resume_ar":"قيامة المسيح من بين الأموات." },
    { "code":"GREAT_LENT_START","offset_jours":-55,"rang":"seigneuriale_mineure","titre_ar":"بدء الصوم الكبير","titre_fr":"Début Grand Carême","resume_ar":"بداية الجهاد الروحي للصوم." },
    { "code":"PALM_SUNDAY","offset_jours":-7,"rang":"seigneuriale_mineure","titre_ar":"أحد الشعانين","titre_fr":"Rameaux","resume_ar":"دخول المسيح أورشليم." },
    { "code":"ASCENSION","offset_jours":39,"rang":"seigneuriale_mineure","titre_ar":"عيد الصعود","titre_fr":"Ascension","resume_ar":"صعود المسيح إلى السماء." },
    { "code":"PENTECOST","offset_jours":49,"rang":"seigneuriale_majeure","titre_ar":"عيد حلول الروح القدس","titre_fr":"Pentecôte","resume_ar":"حلول الروح على الرسل." }
  ],
  "saints": [
    {"id":1,"nom_ar":"القديس مرقس الرسول","nom_fr":"Saint Marc","type":"رسول","jour_copte":30,"mois_copte":8,"resume_ar":"كارز بالإيمان بالإسكندرية ونال الشهادة.","fiabilite":"elevee"},
    {"id":2,"nom_ar":"القديس أثناسيوس الرسولي","nom_fr":"Saint Athanase","type":"بطريرك","jour_copte":7,"mois_copte":9,"resume_ar":"دافع عن ألوهية الابن ضد الأريوسية.","fiabilite":"elevee"},
    {"id":3,"nom_ar":"القديس أنطونيوس الكبير","nom_fr":"Saint Antoine","type":"قديس","jour_copte":22,"mois_copte":5,"resume_ar":"أب الرهبان في البرية.","fiabilite":"elevee"},
    {"id":4,"nom_ar":"القديس باخوميوس","nom_fr":"Saint Pachôme","type":"قديس","jour_copte":14,"mois_copte":9,"resume_ar":"منظم الحياة الديرية المشتركة.","fiabilite":"elevee"},
    {"id":5,"nom_ar":"القديس شنوده رئيس المتوحدين","nom_fr":"Saint Shenouda","type":"قديس","jour_copte":7,"mois_copte":11,"resume_ar":"قاد ديراً كبيراً وأبرز الحياة النسكية.","fiabilite":"moyenne"},
    {"id":6,"nom_ar":"القديس مكاريوس الكبير","nom_fr":"Saint Macaire le Grand","type":"قديس","jour_copte":27,"mois_copte":6,"resume_ar":"أب مشهور بالوداعة والصلاة.","fiabilite":"elevee"},
    {"id":7,"nom_ar":"القديس مكاريوس الإسكندري","nom_fr":"Saint Macaire d'Alexandrie","type":"قديس","jour_copte":27,"mois_copte":12,"resume_ar":"ناسِك عُرف بزهد شديد.","fiabilite":"moyenne"},
    {"id":8,"nom_ar":"القديس البابا كيرلس الكبير","nom_fr":"Saint Cyrille d'Alexandrie","type":"بطريرك","jour_copte":3,"mois_copte":7,"resume_ar":"دافع عن لقب والدة الإله.","fiabilite":"elevee"},
    {"id":9,"nom_ar":"القديس ديسقوروس","nom_fr":"Saint Dioscore","type":"بطريرك","jour_copte":7,"mois_copte":3,"resume_ar":"ثبت في الإيمان ضد مجمع خلقيدونية.","fiabilite":"moyenne"},
    {"id":10,"nom_ar":"القديس ساويرس الأنطاكي","nom_fr":"Saint Sévère d'Antioche","type":"قديس","jour_copte":14,"mois_copte":5,"resume_ar":"لاهوتي وحدوي منفي.","fiabilite":"moyenne"},
    {"id":11,"nom_ar":"الشهيد جرجس","nom_fr":"Saint Georges","type":"شهيد","jour_copte":23,"mois_copte":8,"resume_ar":"جندي شهيد مشهور بعجائبه.","fiabilite":"elevee"},
    {"id":12,"nom_ar":"الشهيد مارمينا","nom_fr":"Saint Mina","type":"شهيد","jour_copte":15,"mois_copte":3,"resume_ar":"جندي ترك العالم ونال الشهادة.","fiabilite":"moyenne"},
    {"id":13,"nom_ar":"القديسة دميانة","nom_fr":"Sainte Demiana","type":"شهيدة","jour_copte":13,"mois_copte":5,"resume_ar":"عاشَت عِفّة وقدّمت نفسها للشهادة.","fiabilite":"moyenne"},
    {"id":14,"nom_ar":"القديسة بربارة","nom_fr":"Sainte Barbe","type":"شهيدة","jour_copte":8,"mois_copte":4,"resume_ar":"شهيدة حفظت الإيمان وسط الاضطهاد.","fiabilite":"faible"},
    {"id":15,"nom_ar":"القديسة كاترينة","nom_fr":"Sainte Catherine","type":"شهيدة","jour_copte":29,"mois_copte":8,"resume_ar":"تعليمية واجهت الفلاسفة وثبتت.","fiabilite":"faible"},
    {"id":16,"nom_ar":"الشهيد فيلوباتير مرقوريوس","nom_fr":"Saint Mercure","type":"شهيد","jour_copte":25,"mois_copte":4,"resume_ar":"جندي نال لقب صاحب السيفين.","fiabilite":"moyenne"},
    {"id":17,"nom_ar":"الشهيد أبى سيفين","nom_fr":"Mercure (Abou Seifein)","type":"شهيد","jour_copte":25,"mois_copte":4,"resume_ar":"لقب بسبب رؤيا السيفين.","fiabilite":"moyenne"},
    {"id":18,"nom_ar":"القديس بيشوي","nom_fr":"Saint Pishoy","type":"قديس","jour_copte":8,"mois_copte":11,"resume_ar":"عرف بمحبة الضيافة ورؤى روحية.","fiabilite":"elevee"},
    {"id":19,"nom_ar":"القديس بولس البسيط","nom_fr":"Paula le Simple","type":"قديس","jour_copte":25,"mois_copte":5,"resume_ar":"تلميذ للقديس أنطونيوس في البرية.","fiabilite":"moyenne"},
    {"id":20,"nom_ar":"القديس أرسانيوس","nom_fr":"Saint Arsène","type":"قديس","jour_copte":13,"mois_copte":10,"resume_ar":"معلّم أولاد الملوك ثم ناسك صامت.","fiabilite":"elevee"},
    {"id":21,"nom_ar":"القديس صموئيل المعترف","nom_fr":"Saint Samuel le Confesseur","type":"قديس","jour_copte":8,"mois_copte":2,"resume_ar":"ثبت ضد العقائد الدخيلة.","fiabilite":"moyenne"},
    {"id":22,"nom_ar":"القديس الأنبا شنوده (آخر)","nom_fr":"Autre Shenouda","type":"قديس","jour_copte":1,"mois_copte":12,"resume_ar":"سيرة نسكية مختصرة.","fiabilite":"faible"},
    {"id":23,"nom_ar":"القديس يوحنا القصير","nom_fr":"Saint Jean le Nain","type":"قديس","jour_copte":20,"mois_copte":2,"resume_ar":"مثال في الطاعة المطلقة.","fiabilite":"elevee"},
    {"id":24,"nom_ar":"القديس إفراهات","nom_fr":"Aphraate","type":"قديس","jour_copte":13,"mois_copte":1,"resume_ar":"حكيم نسكي شرقي.","fiabilite":"faible"},
    {"id":25,"nom_ar":"القديس سمعان العمودي","nom_fr":"Syméon Stylite","type":"قديس","jour_copte":1,"mois_copte":1,"resume_ar":"عابد على العمود مدة طويلة.","fiabilite":"faible"},
    {"id":26,"nom_ar":"القديس البابا كيرلس السادس","nom_fr":"Pape Cyrille VI","type":"بطريرك","jour_copte":30,"mois_copte":6,"resume_ar":"معروف بالصلاة اليومية.","fiabilite":"moyenne"},
    {"id":27,"nom_ar":"القديس البابا شنودة الثالث","nom_fr":"Pape Shenouda III","type":"بطريرك","jour_copte":7,"mois_copte":7,"resume_ar":"قائد رعوي معاصر.","fiabilite":"moyenne"},
    {"id":28,"nom_ar":"القديس البابا أثناسيوس الثاني","nom_fr":"Pape Athanase II","type":"بطريرك","jour_copte":12,"mois_copte":2,"resume_ar":"سيرة موجزة.","fiabilite":"faible"},
    {"id":29,"nom_ar":"القديس البابا ديمتريوس","nom_fr":"Pape Démétrius","type":"بطريرك","jour_copte":12,"mois_copte":7,"resume_ar":"نظم حساب الصوم والفصح.","fiabilite":"elevee"},
    {"id":30,"nom_ar":"القديس البابا بطرس خاتم الشهداء","nom_fr":"Pape Pierre le Sceau des Martyrs","type":"بطريرك","jour_copte":29,"mois_copte":2,"resume_ar":"آخر شهداء السدة البطريركية الأولى.","fiabilite":"elevee"},
    {"id":31,"nom_ar":"القديس البابا بنيامين","nom_fr":"Pape Benjamin","type":"بطريرك","jour_copte":8,"mois_copte":9,"resume_ar":"هرب زمن الاضطهاد الفارسي-العربي.","fiabilite":"moyenne"},
    {"id":32,"nom_ar":"القديس البابا يوساب","nom_fr":"Pape Yousab","type":"بطريرك","jour_copte":17,"mois_copte":12,"resume_ar":"حافظ على الإيمان زمن صعوبات.","fiabilite":"faible"},
    {"id":33,"nom_ar":"القديس البابا كيرلس الرابع","nom_fr":"Pape Cyrille IV","type":"بطريرك","jour_copte":30,"mois_copte":10,"resume_ar":"مصلح تعليمي.","fiabilite":"moyenne"},
    {"id":34,"nom_ar":"القديس البابا يسطس","nom_fr":"Pape Juste","type":"بطريرك","jour_copte":12,"mois_copte":10,"resume_ar":"سيرة قصيرة.","fiabilite":"faible"},
    {"id":35,"nom_ar":"القديس البابا متاؤس المسكين","nom_fr":"Pape Matthaeus the Poor","type":"بطريرك","jour_copte":3,"mois_copte":8,"resume_ar":"معروف بالتواضع.","fiabilite":"faible"},
    {"id":36,"nom_ar":"الشهيد أباديون","nom_fr":"Abadion","type":"شهيد","jour_copte":6,"mois_copte":6,"resume_ar":"استشهد متمسكًا بالإيمان.","fiabilite":"faible"},